{
  "cell_id": "A03__P-scale-001__r1",
  "approach_id": "A03",
  "approach_version": 1,
  "project_id": "P-scale-001",
  "status": "scored",
  "sandbox_path": "sandboxes/A03__P-scale-001__r1",
  "started_at": "2026-07-20T10:10:00Z",
  "finished_at": "2026-07-20T10:30:00Z",
  "metrics": {
    "correctness_pass": true,
    "cycle_time_hours": 0.2,
    "interventions": 0,
    "regression_pass": null,
    "reviewability_notes": "oracle green",
    "recoverability_ok": true,
    "cost_tokens": null,
    "cost_usd": null,
    "wall_time_hours": 0.2
  },
  "fail_tags": [],
  "team_size_sim": "1",
  "triple_test": false,
  "replication_group": null,
  "run_index": 1,
  "superseded_by": null,
  "notes": "pass"
}
