{
  "cell_id": "A03__P-scale-001__clearpath__r1",
  "approach_id": "A03",
  "approach_version": 1,
  "project_id": "P-scale-001",
  "status": "scored",
  "sandbox_path": "projects/clearpath",
  "started_at": "2026-07-20T11:10:00Z",
  "finished_at": "2026-07-20T11:18:00Z",
  "metrics": {
    "correctness_pass": true,
    "cycle_time_hours": 0.13,
    "interventions": 0,
    "regression_pass": true,
    "reviewability_notes": "Keyset pagination on /requests; limit cap 50; 429+Retry-After; SCALE.md complexity note; 17/17 regression",
    "recoverability_ok": true,
    "cost_tokens": null,
    "cost_usd": null,
    "wall_time_hours": 0.13
  },
  "fail_tags": [],
  "team_size_sim": "1",
  "triple_test": false,
  "replication_group": null,
  "run_index": 1,
  "superseded_by": null,
  "notes": "Oracle 4/4. Next: sustain (UI + production-shaped path)."
}
